{"artifact_count":105,"entries":[{"acquisition_attempt":1,"actual_task_count":60,"application":"MONTAGE","command":["bin/AppGenerator","-a","MONTAGE","-n","60"],"family":"montage","path":"pegasus-bharathi-bb1f8d43/montage/0060/r01.dax","replicate_id":"r01","request_mode":"numjobs_search","requested_lanes":null,"requested_numjobs":60,"requested_sequences":null,"sha256":"e006a815147b20d6201b2e4b0f79a5dc7998021fce52564abb24984eaa50c1f7","target_task_count":60},{"acquisition_attempt":1,"actual_task_count":60,"application":"MONTAGE","command":["bin/AppGenerator","-a","MONTAGE","-n","60"],"family":"montage","path":"pegasus-bharathi-bb1f8d43/montage/0060/r02.dax","replicate_id":"r02","request_mode":"numjobs_search","requested_lanes":null,"requested_numjobs":60,"requested_sequences":null,"sha256":"99857321a0cdede23a0e62622ec092ef510861bdd8e4fce72467911e610086f6","target_task_count":60},{"acquisition_attempt":1,"actual_task_count":60,"application":"MONTAGE","command":["bin/AppGenerator","-a","MONTAGE","-n","60"],"family":"montage","path":"pegasus-bharathi-bb1f8d43/montage/0060/r03.dax","replicate_id":"r03","request_mode":"numjobs_search","requested_lanes":null,"requested_numjobs":60,"requested_sequences":null,"sha256":"e8cffb9b511bf3e962e46b5ea06d9bd06184e8229e1ed74ba642f91231e58aae","target_task_count":60},{"acquisition_attempt":1,"actual_task_count":100,"application":"MONTAGE","command":["bin/AppGenerator","-a","MONTAGE","-n","100"],"family":"montage","path":"pegasus-bharathi-bb1f8d43/montage/0100/r01.dax","replicate_id":"r01","request_mode":"numjobs_search","requested_lanes":null,"requested_numjobs":100,"requested_sequences":null,"sha256":"c39ee6274f4cb48f5be2ef1d900278b3cc7301cc61e004050375b3402fe26236","target_task_count":100},{"acquisition_attempt":1,"actual_task_count":100,"application":"MONTAGE","command":["bin/AppGenerator","-a","MONTAGE","-n","100"],"family":"montage","path":"pegasus-bharathi-bb1f8d43/montage/0100/r02.dax","replicate_id":"r02","request_mode":"numjobs_search","requested_lanes":null,"requested_numjobs":100,"requested_sequences":null,"sha256":"2bc59064b0a67262eb69776d5ae97c91d40c2e9f2e9dbcd84ac4a97ebce21a16","target_task_count":100},{"acquisition_attempt":1,"actual_task_count":100,"application":"MONTAGE","command":["bin/AppGenerator","-a","MONTAGE","-n","100"],"family":"montage","path":"pegasus-bharathi-bb1f8d43/montage/0100/r03.dax","replicate_id":"r03","request_mode":"numjobs_search","requested_lanes":null,"requested_numjobs":100,"requested_sequences":null,"sha256":"a6422a7eafe75e1a5d5bb51b97725e254024c3c1ff782cf305b5615aef5984a5","target_task_count":100},{"acquisition_attempt":1,"actual_task_count":200,"application":"MONTAGE","command":["bin/AppGenerator","-a","MONTAGE","-n","200"],"family":"montage","path":"pegasus-bharathi-bb1f8d43/montage/0200/r01.dax","replicate_id":"r01","request_mode":"numjobs_search","requested_lanes":null,"requested_numjobs":200,"requested_sequences":null,"sha256":"086c8439c5ad08ff63f850da114f7c63d0051a07d2064d6ffa5c82e86946c9d1","target_task_count":200},{"acquisition_attempt":1,"actual_task_count":200,"application":"MONTAGE","command":["bin/AppGenerator","-a","MONTAGE","-n","200"],"family":"montage","path":"pegasus-bharathi-bb1f8d43/montage/0200/r02.dax","replicate_id":"r02","request_mode":"numjobs_search","requested_lanes":null,"requested_numjobs":200,"requested_sequences":null,"sha256":"25fb42317b4e86ba853b98fe096a5ec19b7912633721160efed1920009d4c3ea","target_task_count":200},{"acquisition_attempt":1,"actual_task_count":200,"application":"MONTAGE","command":["bin/AppGenerator","-a","MONTAGE","-n","200"],"family":"montage","path":"pegasus-bharathi-bb1f8d43/montage/0200/r03.dax","replicate_id":"r03","request_mode":"numjobs_search","requested_lanes":null,"requested_numjobs":200,"requested_sequences":null,"sha256":"b82df34958641f307213301e2444a90c13a67617ee9bc93922958a702a2f4934","target_task_count":200},{"acquisition_attempt":1,"actual_task_count":400,"application":"MONTAGE","command":["bin/AppGenerator","-a","MONTAGE","-n","400"],"family":"montage","path":"pegasus-bharathi-bb1f8d43/montage/0400/r01.dax","replicate_id":"r01","request_mode":"numjobs_search","requested_lanes":null,"requested_numjobs":400,"requested_sequences":null,"sha256":"f01187c122252b21417fb53123e8e8b75b9f41d88ba14deadc6ce873ffa6c095","target_task_count":400},{"acquisition_attempt":1,"actual_task_count":400,"application":"MONTAGE","command":["bin/AppGenerator","-a","MONTAGE","-n","400"],"family":"montage","path":"pegasus-bharathi-bb1f8d43/montage/0400/r02.dax","replicate_id":"r02","request_mode":"numjobs_search","requested_lanes":null,"requested_numjobs":400,"requested_sequences":null,"sha256":"b6d319b6b9d6cc6671419dd539df03f993f5128d2129c9d2b96038778ebc9fd3","target_task_count":400},{"acquisition_attempt":1,"actual_task_count":400,"application":"MONTAGE","command":["bin/AppGenerator","-a","MONTAGE","-n","400"],"family":"montage","path":"pegasus-bharathi-bb1f8d43/montage/0400/r03.dax","replicate_id":"r03","request_mode":"numjobs_search","requested_lanes":null,"requested_numjobs":400,"requested_sequences":null,"sha256":"2dfa8444e32a6497001ce2df2f0b7f1a97b1d4b0263d9f710c1fd78a55d1179a","target_task_count":400},{"acquisition_attempt":1,"actual_task_count":600,"application":"MONTAGE","command":["bin/AppGenerator","-a","MONTAGE","-n","600"],"family":"montage","path":"pegasus-bharathi-bb1f8d43/montage/0600/r01.dax","replicate_id":"r01","request_mode":"numjobs_search","requested_lanes":null,"requested_numjobs":600,"requested_sequences":null,"sha256":"026cbdf185dc553c2d80ff6e43d63e886901068d24e70ab0d6b5d4f2681311bf","target_task_count":600},{"acquisition_attempt":1,"actual_task_count":600,"application":"MONTAGE","command":["bin/AppGenerator","-a","MONTAGE","-n","600"],"family":"montage","path":"pegasus-bharathi-bb1f8d43/montage/0600/r02.dax","replicate_id":"r02","request_mode":"numjobs_search","requested_lanes":null,"requested_numjobs":600,"requested_sequences":null,"sha256":"05084d4df8b8308192f2c192463d6a08bf05522df3b43481d75a6cf4d13fd782","target_task_count":600},{"acquisition_attempt":1,"actual_task_count":600,"application":"MONTAGE","command":["bin/AppGenerator","-a","MONTAGE","-n","600"],"family":"montage","path":"pegasus-bharathi-bb1f8d43/montage/0600/r03.dax","replicate_id":"r03","request_mode":"numjobs_search","requested_lanes":null,"requested_numjobs":600,"requested_sequences":null,"sha256":"d8e01cea0fc5a1aa7eda855c32ddbc17fe3512ec48df200cc850a5e69fe6e929","target_task_count":600},{"acquisition_attempt":1,"actual_task_count":800,"application":"MONTAGE","command":["bin/AppGenerator","-a","MONTAGE","-n","800"],"family":"montage","path":"pegasus-bharathi-bb1f8d43/montage/0800/r01.dax","replicate_id":"r01","request_mode":"numjobs_search","requested_lanes":null,"requested_numjobs":800,"requested_sequences":null,"sha256":"07fdc5c17b0d9e9484538c7c6b9806526a28d5ea67b73b0b73c1c6620c93c791","target_task_count":800},{"acquisition_attempt":1,"actual_task_count":800,"application":"MONTAGE","command":["bin/AppGenerator","-a","MONTAGE","-n","800"],"family":"montage","path":"pegasus-bharathi-bb1f8d43/montage/0800/r02.dax","replicate_id":"r02","request_mode":"numjobs_search","requested_lanes":null,"requested_numjobs":800,"requested_sequences":null,"sha256":"10680c2b4eafdbd9736e624d2267ca54b51a83a02f2ec062199db9287cc7fdd9","target_task_count":800},{"acquisition_attempt":1,"actual_task_count":800,"application":"MONTAGE","command":["bin/AppGenerator","-a","MONTAGE","-n","800"],"family":"montage","path":"pegasus-bharathi-bb1f8d43/montage/0800/r03.dax","replicate_id":"r03","request_mode":"numjobs_search","requested_lanes":null,"requested_numjobs":800,"requested_sequences":null,"sha256":"7336a81d7fc27e52675a57a71caa7348c732effbd87e636dbe73c3c3366736e6","target_task_count":800},{"acquisition_attempt":1,"actual_task_count":1000,"application":"MONTAGE","command":["bin/AppGenerator","-a","MONTAGE","-n","1000"],"family":"montage","path":"pegasus-bharathi-bb1f8d43/montage/1000/r01.dax","replicate_id":"r01","request_mode":"numjobs_search","requested_lanes":null,"requested_numjobs":1000,"requested_sequences":null,"sha256":"f6ab69922a817649d0213ee1eeb0d12d090ac83967df2582c71f794b81c9fbd9","target_task_count":1000},{"acquisition_attempt":1,"actual_task_count":1000,"application":"MONTAGE","command":["bin/AppGenerator","-a","MONTAGE","-n","1000"],"family":"montage","path":"pegasus-bharathi-bb1f8d43/montage/1000/r02.dax","replicate_id":"r02","request_mode":"numjobs_search","requested_lanes":null,"requested_numjobs":1000,"requested_sequences":null,"sha256":"78bdca89abce5ae3d682ecc47256aac8e2aeece7a5761ecb52f70f747f4657ea","target_task_count":1000},{"acquisition_attempt":1,"actual_task_count":1000,"application":"MONTAGE","command":["bin/AppGenerator","-a","MONTAGE","-n","1000"],"family":"montage","path":"pegasus-bharathi-bb1f8d43/montage/1000/r03.dax","replicate_id":"r03","request_mode":"numjobs_search","requested_lanes":null,"requested_numjobs":1000,"requested_sequences":null,"sha256":"d9cde089ea4dcf9ec9eb448e41a270c26bd7796b48b4279a19f878233462d83f","target_task_count":1000},{"acquisition_attempt":1,"actual_task_count":60,"application":"CYBERSHAKE","command":["bin/AppGenerator","-a","CYBERSHAKE","-n","60"],"family":"cybershake","path":"pegasus-bharathi-bb1f8d43/cybershake/0060/r01.dax","replicate_id":"r01","request_mode":"numjobs_search","requested_lanes":null,"requested_numjobs":60,"requested_sequences":null,"sha256":"ce276e5fb8211239c48ff995a14ecc88c49fa87cd83de7d2e5b069fe00dd243e","target_task_count":60},{"acquisition_attempt":1,"actual_task_count":60,"application":"CYBERSHAKE","command":["bin/AppGenerator","-a","CYBERSHAKE","-n","60"],"family":"cybershake","path":"pegasus-bharathi-bb1f8d43/cybershake/0060/r02.dax","replicate_id":"r02","request_mode":"numjobs_search","requested_lanes":null,"requested_numjobs":60,"requested_sequences":null,"sha256":"bc1f2aebdcfbd63eb26c094fa64bfd50ac3a18b4822f48789b343a7d8de23966","target_task_cou